[
  {
    "id": "CLAIM-050001",
    "text": "The FDA Purple Book records September 25, 1998 as the original approval date for trastuzumab (Herceptin).",
    "claim_type": "result",
    "evidence_ids": [
      "EVID-050001"
    ],
    "confidence": "confirmed",
    "review_state": "machine_proposed",
    "supersedes_claim_id": null,
    "observed_at": "2026-09-20T14:45:00Z",
    "valid_from": "1998-09-25T00:00:00Z",
    "valid_to": null
  },
  {
    "id": "CLAIM-050002",
    "text": "The FDA orphan-drug record lists a May 10, 2001 marketing approval for imatinib (Gleevec) in chronic myeloid leukemia.",
    "claim_type": "result",
    "evidence_ids": [
      "EVID-050002"
    ],
    "confidence": "confirmed",
    "review_state": "machine_proposed",
    "supersedes_claim_id": null,
    "observed_at": "2026-09-20T14:45:00Z",
    "valid_from": "2001-05-10T00:00:00Z",
    "valid_to": null
  },
  {
    "id": "CLAIM-050003",
    "text": "The FDA Purple Book records April 29, 2010 as the original approval date for sipuleucel-T (Provenge).",
    "claim_type": "result",
    "evidence_ids": [
      "EVID-050003"
    ],
    "confidence": "confirmed",
    "review_state": "machine_proposed",
    "supersedes_claim_id": null,
    "observed_at": "2026-09-20T14:45:00Z",
    "valid_from": "2010-04-29T00:00:00Z",
    "valid_to": null
  },
  {
    "id": "CLAIM-050004",
    "text": "FDA records an August 30, 2017 original approval for tisagenlecleucel (Kymriah), a CD19-directed CAR-T therapy.",
    "claim_type": "result",
    "evidence_ids": [
      "EVID-050004"
    ],
    "confidence": "confirmed",
    "review_state": "machine_proposed",
    "supersedes_claim_id": null,
    "observed_at": "2026-09-20T14:45:00Z",
    "valid_from": "2017-08-30T00:00:00Z",
    "valid_to": null
  },
  {
    "id": "CLAIM-050005",
    "text": "On June 29, 2020, FDA approved pembrolizumab for first-line unresectable or metastatic MSI-H/dMMR colorectal cancer based on the randomized KEYNOTE-177 trial.",
    "claim_type": "result",
    "evidence_ids": [
      "EVID-050005"
    ],
    "confidence": "confirmed",
    "review_state": "machine_proposed",
    "supersedes_claim_id": null,
    "observed_at": "2026-09-20T14:45:00Z",
    "valid_from": "2020-06-29T00:00:00Z",
    "valid_to": null
  },
  {
    "id": "CLAIM-050006",
    "text": "A 2009 multi-site mouse study reported that rapamycin started late in life extended lifespan in genetically heterogeneous mice.",
    "claim_type": "result",
    "evidence_ids": [
      "EVID-050006"
    ],
    "confidence": "solid_preliminary",
    "review_state": "machine_proposed",
    "supersedes_claim_id": null,
    "observed_at": "2026-09-20T14:45:00Z",
    "valid_from": "2009-07-08T00:00:00Z",
    "valid_to": null
  },
  {
    "id": "CLAIM-050007",
    "text": "In a progeroid mouse model, inducible clearance of p16Ink4a-positive senescent cells delayed or attenuated several age-associated disorders.",
    "claim_type": "result",
    "evidence_ids": [
      "EVID-050007"
    ],
    "confidence": "solid_preliminary",
    "review_state": "machine_proposed",
    "supersedes_claim_id": null,
    "observed_at": "2026-09-20T14:45:00Z",
    "valid_from": "2011-11-02T00:00:00Z",
    "valid_to": null
  },
  {
    "id": "CLAIM-050008",
    "text": "A 2016 study reported that clearance of p16Ink4a-positive cells extended median lifespan in male and female wild-type mice from two genetic backgrounds.",
    "claim_type": "result",
    "evidence_ids": [
      "EVID-050008"
    ],
    "confidence": "solid_preliminary",
    "review_state": "machine_proposed",
    "supersedes_claim_id": null,
    "observed_at": "2026-09-20T14:45:00Z",
    "valid_from": "2016-02-03T00:00:00Z",
    "valid_to": null
  },
  {
    "id": "CLAIM-050009",
    "text": "In CALERIE participants, about 15% caloric restriction over two years was associated with sustained metabolic adaptation and reduced oxidative-stress markers.",
    "claim_type": "result",
    "evidence_ids": [
      "EVID-050009"
    ],
    "confidence": "solid_preliminary",
    "review_state": "machine_proposed",
    "supersedes_claim_id": null,
    "observed_at": "2026-09-20T14:45:00Z",
    "valid_from": "2018-03-22T00:00:00Z",
    "valid_to": null
  },
  {
    "id": "CLAIM-050010",
    "text": "A CALERIE secondary analysis reported a roughly 2–3% slowing in DunedinPACE under caloric restriction, while other epigenetic age measures did not show significant change.",
    "claim_type": "result",
    "evidence_ids": [
      "EVID-050010"
    ],
    "confidence": "solid_preliminary",
    "review_state": "machine_proposed",
    "supersedes_claim_id": null,
    "observed_at": "2026-09-20T14:45:00Z",
    "valid_from": "2023-02-09T00:00:00Z",
    "valid_to": null
  },
  {
    "id": "CLAIM-050011",
    "text": "A 2011 case report found that lumbosacral epidural stimulation enabled weight-bearing standing and some intentional lower-limb movement in a person with motor-complete paraplegia.",
    "claim_type": "result",
    "evidence_ids": [
      "EVID-050011"
    ],
    "confidence": "solid_preliminary",
    "review_state": "machine_proposed",
    "supersedes_claim_id": null,
    "observed_at": "2026-09-20T14:45:00Z",
    "valid_from": "2011-06-04T00:00:00Z",
    "valid_to": null
  },
  {
    "id": "CLAIM-050012",
    "text": "A 2018 study reported that targeted spatiotemporal spinal stimulation enabled voluntary control of walking-related movements in participants with chronic spinal cord injury.",
    "claim_type": "result",
    "evidence_ids": [
      "EVID-050012"
    ],
    "confidence": "solid_preliminary",
    "review_state": "machine_proposed",
    "supersedes_claim_id": null,
    "observed_at": "2026-09-20T14:45:00Z",
    "valid_from": "2018-10-31T00:00:00Z",
    "valid_to": null
  },
  {
    "id": "CLAIM-050013",
    "text": "A 2019 report described a tetraplegic participant controlling a four-limb exoskeleton using an implanted brain-machine interface during a 24-month study.",
    "claim_type": "result",
    "evidence_ids": [
      "EVID-050013"
    ],
    "confidence": "solid_preliminary",
    "review_state": "machine_proposed",
    "supersedes_claim_id": null,
    "observed_at": "2026-09-20T14:45:00Z",
    "valid_from": "2019-10-03T00:00:00Z",
    "valid_to": null
  },
  {
    "id": "CLAIM-050014",
    "text": "A 2022 study reported rapid restoration of several trunk and leg motor functions with targeted spinal-cord neuromodulation in participants with complete sensorimotor paralysis.",
    "claim_type": "result",
    "evidence_ids": [
      "EVID-050014"
    ],
    "confidence": "solid_preliminary",
    "review_state": "machine_proposed",
    "supersedes_claim_id": null,
    "observed_at": "2026-09-20T14:45:00Z",
    "valid_from": "2022-02-07T00:00:00Z",
    "valid_to": null
  },
  {
    "id": "CLAIM-050015",
    "text": "A 2023 brain–spine interface study reported natural control over standing and walking in a participant with chronic tetraplegia, with stable use over one year.",
    "claim_type": "result",
    "evidence_ids": [
      "EVID-050015"
    ],
    "confidence": "solid_preliminary",
    "review_state": "machine_proposed",
    "supersedes_claim_id": null,
    "observed_at": "2026-09-20T14:45:00Z",
    "valid_from": "2023-05-24T00:00:00Z",
    "valid_to": null
  },
  {
    "id": "CLAIM-050016",
    "text": "FDA's humanitarian-device database records a February 13, 2013 approval decision for the Argus II retinal prosthesis system.",
    "claim_type": "result",
    "evidence_ids": [
      "EVID-050016"
    ],
    "confidence": "confirmed",
    "review_state": "machine_proposed",
    "supersedes_claim_id": null,
    "observed_at": "2026-09-20T14:45:00Z",
    "valid_from": "2013-02-13T00:00:00Z",
    "valid_to": null
  },
  {
    "id": "CLAIM-050017",
    "text": "An open-label follow-up of 18 treated eyes reported medium-to-long-term safety findings and visual-acuity improvement in 10 eyes after hESC-derived retinal pigment epithelium transplantation.",
    "claim_type": "result",
    "evidence_ids": [
      "EVID-050017"
    ],
    "confidence": "solid_preliminary",
    "review_state": "machine_proposed",
    "supersedes_claim_id": null,
    "observed_at": "2026-09-20T14:45:00Z",
    "valid_from": "2014-10-15T00:00:00Z",
    "valid_to": null
  },
  {
    "id": "CLAIM-050018",
    "text": "A randomized phase 3 trial reported improved functional vision on the multi-luminance mobility test after voretigene neparvovec for biallelic RPE65-mediated retinal dystrophy.",
    "claim_type": "result",
    "evidence_ids": [
      "EVID-050018"
    ],
    "confidence": "solid_preliminary",
    "review_state": "machine_proposed",
    "supersedes_claim_id": null,
    "observed_at": "2026-09-20T14:45:00Z",
    "valid_from": "2017-07-14T00:00:00Z",
    "valid_to": null
  },
  {
    "id": "CLAIM-050019",
    "text": "FDA records December 19, 2017 as the original approval date for Luxturna for an inherited retinal-dystrophy indication involving biallelic RPE65 mutations.",
    "claim_type": "result",
    "evidence_ids": [
      "EVID-050019"
    ],
    "confidence": "confirmed",
    "review_state": "machine_proposed",
    "supersedes_claim_id": null,
    "observed_at": "2026-09-20T14:45:00Z",
    "valid_from": "2017-12-19T00:00:00Z",
    "valid_to": null
  },
  {
    "id": "CLAIM-050020",
    "text": "A 2021 case report described partial functional visual recovery in a blind patient after optogenetic therapy combined with engineered goggles.",
    "claim_type": "result",
    "evidence_ids": [
      "EVID-050020"
    ],
    "confidence": "solid_preliminary",
    "review_state": "machine_proposed",
    "supersedes_claim_id": null,
    "observed_at": "2026-09-20T14:45:00Z",
    "valid_from": "2021-05-24T00:00:00Z",
    "valid_to": null
  },
  {
    "id": "CLAIM-050021",